{"adapter":{"id":"fixture-adapter","version":"1"},"authority_id":"bb224f4a1aa46dbb9545f32e902e7d2c168f22437354c708db539fabf4c36ebd","base_profile_sha256":"1111111111111111111111111111111111111111111111111111111111111111","expected_authority_sha256":"546b85095423ccd9c6e7eb177f022d4388f1e29a621866385079215d7d1d9520","mode":"required","policy":{"id":"fixture-policy","version":"1"},"provider":"codex","schema":"org.agent-harness.dependency-requirement.v1","selected_executable":{"kind":"file","mode":"0755","path":"/fixture/tmpfej2jv1e/release/bin/codex","sha256":"a622b10ddc23c8c9e9ec39d4833ae9b7b772ef40cb430425cb1689b76ec3490c","size":7}}