{"adapter":{"id":"fixture-adapter","version":"1"},"authority_id":"ddf9611510d07a74ac9cba1e2a526c59c2f0f9b7887422a50e3e1cfbb9755c25","base_profile_sha256":"1111111111111111111111111111111111111111111111111111111111111111","expected_authority_sha256":"f95ee1c90a605a17e854746c6b41a95c6695cb706a0bbac9628b6d292730c085","mode":"required","policy":{"id":"fixture-policy","version":"1"},"provider":"codex","schema":"org.agent-harness.dependency-requirement.v1","selected_executable":{"kind":"file","mode":"0755","path":"/srv/synthetic-runtime/v2/bin/codex","sha256":"a622b10ddc23c8c9e9ec39d4833ae9b7b772ef40cb430425cb1689b76ec3490c","size":7}}